{
  "$schema": "./ratchet.schema.json",
  "version": 1,
  "family": "maplibre-listeners-only-on-abort-signals",
  "ledger": "2.1-M186",
  "tool": "ast-grep",
  "scope": [
    "desktop/web/src/**"
  ],
  "lane": "commit",
  "keys": "path",
  "select": [
    "maplibre-listeners-only-on-abort-signals"
  ],
  "entries": {
    "desktop/web/src/maplibre/satellite-provider-session.ts": {
      "count": 1
    }
  }
}
