{
  "$schema": "./ratchet.schema.json",
  "version": 1,
  "family": "point-editor-imports-only-pure",
  "ledger": "2.1-M186",
  "tool": "dependency-cruiser",
  "scope": [
    "desktop/web/src/**"
  ],
  "lane": "commit",
  "keys": "name",
  "select": [
    "point-editor-imports-only-pure"
  ],
  "entries": {}
}
