{
  "$schema": "./ratchet.schema.json",
  "version": 1,
  "family": "place-search-imports-no-geocoding-transport",
  "ledger": "2.1-M186",
  "tool": "dependency-cruiser",
  "scope": [
    "desktop/web/src/**"
  ],
  "lane": "commit",
  "keys": "name",
  "select": [
    "place-search-imports-no-geocoding-transport"
  ],
  "entries": {}
}
