{
  "$schema": "./ratchet.schema.json",
  "version": 1,
  "family": "no-currency-symbol-table",
  "ledger": "2.1-M189",
  "tool": "ast-grep",
  "scope": [
    "desktop/web/src/**"
  ],
  "lane": "commit",
  "keys": "path",
  "select": [
    "no-currency-symbol-table"
  ],
  "entries": {
    "desktop/web/src/app/contracts/canopi-design-schema-decoder.ts": {
      "count": 2,
      "bead": "canopi-f47t.52.11"
    },
    "desktop/web/src/components/canvas/budget-currencies.ts": {
      "count": 6,
      "bead": "canopi-f47t.52.11"
    }
  }
}
