{
  "$schema": "./ratchet.schema.json",
  "version": 1,
  "family": "browser-workspace-imports-no-desktop",
  "ledger": "2.1-M186",
  "tool": "dependency-cruiser",
  "scope": [
    "desktop/web/src/**"
  ],
  "lane": "commit",
  "keys": "name",
  "select": [
    "browser-workspace-imports-no-desktop"
  ],
  "entries": {}
}
