{
  "$schema": "./ratchet.schema.json",
  "version": 1,
  "family": "persistence-capability-imported-only-by-owners",
  "ledger": "2.1-M186",
  "tool": "dependency-cruiser",
  "scope": [
    "desktop/web/src/**"
  ],
  "lane": "commit",
  "keys": "name",
  "select": [
    "persistence-capability-imported-only-by-owners"
  ],
  "entries": {
    "app/document-session/store.ts -> app/document-session/persistence-capability.ts": {
      "count": 1
    }
  }
}
