{
  "$schema": "./ratchet.schema.json",
  "version": 1,
  "family": "web-templates-import-no-desktop-authority",
  "ledger": "2.1-M186",
  "tool": "dependency-cruiser",
  "scope": [
    "desktop/web/src/**"
  ],
  "lane": "commit",
  "keys": "name",
  "select": [
    "web-templates-import-no-desktop-authority"
  ],
  "entries": {}
}
