{
  "$schema": "./ratchet.schema.json",
  "version": 1,
  "family": "menu-bar-imports-no-session-state",
  "ledger": "2.1-M186",
  "tool": "dependency-cruiser",
  "scope": [
    "desktop/web/src/**"
  ],
  "lane": "commit",
  "keys": "name",
  "select": [
    "menu-bar-imports-no-session-state"
  ],
  "entries": {}
}
