{
  "$schema": "./ratchet.schema.json",
  "version": 1,
  "family": "bundle-size",
  "ledger": "2.1-Q203",
  "tool": "bundle-size",
  "scope": ["desktop/web/vite.config.ts"],
  "lane": "ci",
  "budgets": {
    "desktop chunk: ActionMenu": { "ceiling": 5655, "tolerance": 0.05 },
    "desktop chunk: BudgetPanel": { "ceiling": 12434, "tolerance": 0.05 },
    "desktop chunk: CalendarPanel": { "ceiling": 37184, "tolerance": 0.05 },
    "desktop chunk: ConsortiumPanel": { "ceiling": 15752, "tolerance": 0.05 },
    "desktop chunk: DataDialogs": { "ceiling": 35881, "tolerance": 0.05 },
    "desktop chunk: DesignNotebookPanel": { "ceiling": 12141, "tolerance": 0.05 },
    "desktop chunk: DesktopSpeciesKeyPanel": { "ceiling": 10918, "tolerance": 0.05 },
    "desktop chunk: DockPanelHeader": { "ceiling": 297, "tolerance": 0.05 },
    "desktop chunk: Dropdown": { "ceiling": 6937, "tolerance": 0.05 },
    "desktop chunk: EmptyState": { "ceiling": 503, "tolerance": 0.05 },
    "desktop chunk: FavoritesPanel": { "ceiling": 24093, "tolerance": 0.05 },
    "desktop chunk: LayersPanel": { "ceiling": 13793, "tolerance": 0.05 },
    "desktop chunk: LercDecode": { "ceiling": 46740, "tolerance": 0.05 },
    "desktop chunk: LercDecode.es": { "ceiling": 9904, "tolerance": 0.05 },
    "desktop chunk: Notice": { "ceiling": 606, "tolerance": 0.05 },
    "desktop chunk: PanelIcon": { "ceiling": 1911, "tolerance": 0.05 },
    "desktop chunk: PlantDbPanel": { "ceiling": 40058, "tolerance": 0.05 },
    "desktop chunk: PlantDetailCard": { "ceiling": 34338, "tolerance": 0.05 },
    "desktop chunk: SegmentedControl": { "ceiling": 1136, "tolerance": 0.05 },
    "desktop chunk: SiteDataPanel": { "ceiling": 30999, "tolerance": 0.05 },
    "desktop chunk: Slider": { "ceiling": 637, "tolerance": 0.05 },
    "desktop chunk: StoriesPanel": { "ceiling": 24030, "tolerance": 0.05 },
    "desktop chunk: SurfaceHeader": { "ceiling": 1311293, "tolerance": 0.05 },
    "desktop chunk: SurfaceSearch": { "ceiling": 822, "tolerance": 0.05 },
    "desktop chunk: Switch": { "ceiling": 849, "tolerance": 0.05 },
    "desktop chunk: THIRD_PARTY_NOTICES": { "ceiling": 730269, "tolerance": 0.05 },
    "desktop chunk: ZoomControls": { "ceiling": 19936, "tolerance": 0.05 },
    "desktop chunk: __vite-browser-external": { "ceiling": 290, "tolerance": 0.05 },
    "desktop chunk: actions": { "ceiling": 1242, "tolerance": 0.05 },
    "desktop chunk: arming": { "ceiling": 5034, "tolerance": 0.05 },
    "desktop chunk: basedecoder": { "ceiling": 1291, "tolerance": 0.05 },
    "desktop chunk: browserAll": { "ceiling": 42514, "tolerance": 0.05 },
    "desktop chunk: calendar-request": { "ceiling": 189, "tolerance": 0.05 },
    "desktop chunk: canopi-design-format": { "ceiling": 185, "tolerance": 0.05 },
    "desktop chunk: cog-tiler": { "ceiling": 533241, "tolerance": 0.05 },
    "desktop chunk: contextual-selection-actions": { "ceiling": 3798, "tolerance": 0.05 },
    "desktop chunk: core": { "ceiling": 432, "tolerance": 0.05 },
    "desktop chunk: coverage": { "ceiling": 858, "tolerance": 0.05 },
    "desktop chunk: decode": { "ceiling": 15407, "tolerance": 0.05 },
    "desktop chunk: deflate": { "ceiling": 369, "tolerance": 0.05 },
    "desktop chunk: design-edit": { "ceiling": 9781, "tolerance": 0.05 },
    "desktop chunk: design-notebook": { "ceiling": 42365, "tolerance": 0.05 },
    "desktop chunk: dialogs": { "ceiling": 163, "tolerance": 0.05 },
    "desktop chunk: display": { "ceiling": 14717, "tolerance": 0.05 },
    "desktop chunk: dist": { "ceiling": 30097, "tolerance": 0.05 },
    "desktop chunk: escape-chain": { "ceiling": 903, "tolerance": 0.05 },
    "desktop chunk: export": { "ceiling": 2305, "tolerance": 0.05 },
    "desktop chunk: favorite-species-presentation": { "ceiling": 895, "tolerance": 0.05 },
    "desktop chunk: focus-owner": { "ceiling": 1574, "tolerance": 0.05 },
    "desktop chunk: format-count": { "ceiling": 191486, "tolerance": 0.05 },
    "desktop chunk: geotiff": { "ceiling": 306013, "tolerance": 0.05 },
    "desktop chunk: globals": { "ceiling": 8007, "tolerance": 0.05 },
    "desktop chunk: i18n": { "ceiling": 43439, "tolerance": 0.05 },
    "desktop chunk: ids": { "ceiling": 667, "tolerance": 0.05 },
    "desktop chunk: index": { "ceiling": 504108, "tolerance": 0.05 },
    "desktop chunk: init": { "ceiling": 136923, "tolerance": 0.05 },
    "desktop chunk: item-text": { "ceiling": 9300, "tolerance": 0.05 },
    "desktop chunk: job": { "ceiling": 607757, "tolerance": 0.05 },
    "desktop chunk: jpeg": { "ceiling": 21659, "tolerance": 0.05 },
    "desktop chunk: keymap": { "ceiling": 377518, "tolerance": 0.05 },
    "desktop chunk: layer-row.module": { "ceiling": 599, "tolerance": 0.05 },
    "desktop chunk: lerc": { "ceiling": 2093, "tolerance": 0.05 },
    "desktop chunk: library-navigation": { "ceiling": 17982, "tolerance": 0.05 },
    "desktop chunk: lzw": { "ceiling": 18421, "tolerance": 0.05 },
    "desktop chunk: map-matches": { "ceiling": 1679, "tolerance": 0.05 },
    "desktop chunk: maplibre-gl": { "ceiling": 1058276, "tolerance": 0.05 },
    "desktop chunk: maplibre-gl-worker": { "ceiling": 509003, "tolerance": 0.05 },
    "desktop chunk: modal-layer": { "ceiling": 404, "tolerance": 0.05 },
    "desktop chunk: mutation-queue": { "ceiling": 2047, "tolerance": 0.05 },
    "desktop chunk: new-design-defaults": { "ceiling": 227, "tolerance": 0.05 },
    "desktop chunk: overrides": { "ceiling": 264, "tolerance": 0.05 },
    "desktop chunk: packbits": { "ceiling": 689, "tolerance": 0.05 },
    "desktop chunk: pako.esm": { "ceiling": 94074, "tolerance": 0.05 },
    "desktop chunk: planning-projection": { "ceiling": 11646, "tolerance": 0.05 },
    "desktop chunk: plant-display": { "ceiling": 11245, "tolerance": 0.05 },
    "desktop chunk: plant-symbol-recipes": { "ceiling": 18164, "tolerance": 0.05 },
    "desktop chunk: price-request": { "ceiling": 194, "tolerance": 0.05 },
    "desktop chunk: profile": { "ceiling": 6855, "tolerance": 0.05 },
    "desktop chunk: projection": { "ceiling": 10320, "tolerance": 0.05 },
    "desktop chunk: quick-filters": { "ceiling": 1475, "tolerance": 0.05 },
    "desktop chunk: raster-display": { "ceiling": 1445952, "tolerance": 0.05 },
    "desktop chunk: raw": { "ceiling": 225, "tolerance": 0.05 },
    "desktop chunk: registry": { "ceiling": 46633, "tolerance": 0.05 },
    "desktop chunk: rolldown-runtime": { "ceiling": 1325, "tolerance": 0.05 },
    "desktop chunk: scene": { "ceiling": 9344, "tolerance": 0.05 },
    "desktop chunk: selection": { "ceiling": 504, "tolerance": 0.05 },
    "desktop chunk: species-row.module": { "ceiling": 14377, "tolerance": 0.05 },
    "desktop chunk: state": { "ceiling": 567, "tolerance": 0.05 },
    "desktop chunk: stories": { "ceiling": 11276, "tolerance": 0.05 },
    "desktop chunk: tauri": { "ceiling": 16176, "tolerance": 0.05 },
    "desktop chunk: time-model": { "ceiling": 1037, "tolerance": 0.05 },
    "desktop chunk: toolbar-icons": { "ceiling": 4450, "tolerance": 0.05 },
    "desktop chunk: use-plant-finder": { "ceiling": 299, "tolerance": 0.05 },
    "desktop chunk: use-popover-escape-layer": { "ceiling": 346, "tolerance": 0.05 },
    "desktop chunk: usePointerReorder": { "ceiling": 1573, "tolerance": 0.05 },
    "desktop chunk: usePointerResize": { "ceiling": 14048, "tolerance": 0.05 },
    "desktop chunk: visible-map-area": { "ceiling": 4247, "tolerance": 0.05 },
    "desktop chunk: webgl": { "ceiling": 214, "tolerance": 0.05 },
    "desktop chunk: webgl-device": { "ceiling": 60, "tolerance": 0.05 },
    "desktop chunk: webgpu": { "ceiling": 214, "tolerance": 0.05 },
    "desktop chunk: webimage": { "ceiling": 1867, "tolerance": 0.05 },
    "desktop chunk: webworkerAll": { "ceiling": 27, "tolerance": 0.05 },
    "desktop chunk: worker": { "ceiling": 851401, "tolerance": 0.05 },
    "desktop chunk: zone-geometry": { "ceiling": 2603, "tolerance": 0.05 },
    "desktop chunk: zone-label": { "ceiling": 1120, "tolerance": 0.05 },
    "desktop chunk: zstd": { "ceiling": 169494, "tolerance": 0.05 },
    "desktop chunk: zstddec.modern": { "ceiling": 146605, "tolerance": 0.05 },
    "web chunk: THIRD_PARTY_NOTICES": { "ceiling": 730269, "tolerance": 0.05 },
    "web chunk: WorldMapPanel": { "ceiling": 7207, "tolerance": 0.05 },
    "web chunk: WorldMapSurface": { "ceiling": 2652, "tolerance": 0.05 },
    "web chunk: browserAll": { "ceiling": 42515, "tolerance": 0.05 },
    "web chunk: i18n": { "ceiling": 43439, "tolerance": 0.05 },
    "web chunk: job": { "ceiling": 607757, "tolerance": 0.05 },
    "web chunk: maplibre-gl": { "ceiling": 1057808, "tolerance": 0.05 },
    "web chunk: maplibre-gl-worker": { "ceiling": 508951, "tolerance": 0.05 },
    "web chunk: preload-helper": { "ceiling": 34142, "tolerance": 0.05 },
    "web chunk: rolldown-runtime": { "ceiling": 726, "tolerance": 0.05 },
    "web chunk: web": { "ceiling": 3119954, "tolerance": 0.05 },
    "web chunk: webworkerAll": { "ceiling": 34, "tolerance": 0.05 }
  }
}
