{
  "$schema": "./ratchet.schema.json",
  "version": 1,
  "family": "shared-modules-reach-no-native",
  "ledger": "2.1-M186",
  "tool": "dependency-cruiser",
  "scope": [
    "desktop/web/src/**"
  ],
  "lane": "commit",
  "keys": "name",
  "select": [
    "shared-modules-reach-no-native"
  ],
  "entries": {}
}
