{
  "$schema": "./ratchet.schema.json",
  "version": 1,
  "family": "deep-imports",
  "ledger": "2.1-M224",
  "tool": "dependency-cruiser",
  "scope": ["desktop/web/src/**"],
  "lane": "commit",
  "keys": "name",
  "select": ["deep-imports"],
  "entries": {
    "app/canvas-commands/index.ts -> app/shell-commands/shortcut-text.ts": { "count": 1 },
    "app/canvas-context-menu/entries.ts -> app/canvas-commands/edit-availability.ts": { "count": 1 },
    "app/canvas-context-menu/entries.ts -> app/shell-commands/shortcut-text.ts": { "count": 1 },
    "app/canvas-map-surface/desktop-workspace-map-contribution-adapter.ts -> app/story-presentation/overrides.ts": { "count": 1 },
    "app/canvas-map-surface/map-notice.ts -> app/story-presentation/overrides.ts": { "count": 1 },
    "app/canvas-map-surface/workspace-activation-snapshot.ts -> app/story-presentation/overrides.ts": { "count": 1 },
    "app/canvas-map-surface/workspace-runtime-composition.ts -> app/story-presentation/overrides.ts": { "count": 1 },
    "app/canvas-pdf/workflow.ts -> app/plant-browser/workbench.ts": { "count": 1 },
    "app/canvas-runtime/app-adapter.ts -> app/story-presentation/overrides.ts": { "count": 1 },
    "app/document-session/replacement.ts -> app/design-edit/plant-display.ts": { "count": 1 },
    "app/document-session/store.ts -> app/design-edit/authority-capability.ts": { "count": 1 },
    "app/keyboard/keymap.ts -> app/shell-commands/shortcut-text.ts": { "count": 1 },
    "app/lidar/actions.ts -> app/design-edit/lidar.ts": { "count": 1 },
    "app/lidar/display.ts -> app/story-presentation/overrides.ts": { "count": 1 },
    "app/my-location/session.ts -> app/story-presentation/overrides.ts": { "count": 1 },
    "app/panel-targets/presentation.ts -> app/story-presentation/overrides.ts": { "count": 1 },
    "app/plant-display/actions.ts -> app/design-edit/plant-display.ts": { "count": 1 },
    "app/plant-display/menu.ts -> app/shell-commands/menus.ts": { "count": 1 },
    "app/plant-display/state.ts -> app/design-edit/plant-display.ts": { "count": 1 },
    "app/saved-views/menu.ts -> app/shell-commands/menus.ts": { "count": 1 },
    "app/settings/new-design-defaults.ts -> app/design-edit/plant-display.ts": { "count": 1 },
    "app/stories/actions.ts -> app/saved-views/current-view.ts": { "count": 1 },
    "app/stories/step-view.ts -> app/saved-views/snapshot.ts": { "count": 1 },
    "app/story-presentation/controller.ts -> app/saved-views/current-view.ts": { "count": 1 },
    "app/story-presentation/controller.ts -> app/saved-views/snapshot.ts": { "count": 1 },
    "canvas/runtime/interaction-ports.ts -> canvas/runtime/scene/design-object-targets.ts": { "count": 1 },
    "canvas/runtime/interaction-ports.ts -> canvas/runtime/scene/store.ts": { "count": 1 },
    "canvas/runtime/plant-presentation.ts -> canvas/runtime/scene/plant-symbols.ts": { "count": 1 },
    "canvas/runtime/plant-presentation.ts -> canvas/runtime/scene/types.ts": { "count": 1 },
    "canvas/runtime/plant-symbol-recipes.ts -> canvas/runtime/scene/plant-symbols.ts": { "count": 1 },
    "canvas/runtime/scene-extent.ts -> canvas/runtime/scene/group-members.ts": { "count": 1 },
    "canvas/runtime/species-key.ts -> canvas/runtime/scene/plant-symbols.ts": { "count": 1 },
    "canvas/runtime/species-key.ts -> canvas/runtime/scene/types.ts": { "count": 1 },
    "canvas/runtime/tools/distance-guides.ts -> canvas/runtime/scene/types.ts": { "count": 1 },
    "canvas/runtime/tools/measure-labels.ts -> canvas/runtime/scene/design-object-targets.ts": { "count": 1 },
    "canvas/runtime/tools/measure-labels.ts -> canvas/runtime/scene/group-members.ts": { "count": 1 },
    "canvas/runtime/tools/measure-labels.ts -> canvas/runtime/scene/types.ts": { "count": 1 },
    "canvas/runtime/tools/object-stamp.ts -> canvas/runtime/scene/design-object-targets.ts": { "count": 1 },
    "canvas/runtime/tools/object-stamp.ts -> canvas/runtime/scene/group-members.ts": { "count": 1 },
    "canvas/runtime/tools/object-stamp.ts -> canvas/runtime/scene/locks.ts": { "count": 1 },
    "canvas/runtime/tools/object-stamp.ts -> canvas/runtime/scene/types.ts": { "count": 1 },
    "canvas/runtime/tools/plant-row.ts -> canvas/runtime/scene/group-members.ts": { "count": 1 },
    "canvas/runtime/tools/plant-row.ts -> canvas/runtime/scene/locks.ts": { "count": 1 },
    "canvas/runtime/tools/plant-row.ts -> canvas/runtime/scene/plant-symbols.ts": { "count": 1 },
    "canvas/runtime/tools/plant-row.ts -> canvas/runtime/scene/types.ts": { "count": 1 },
    "canvas/runtime/tools/saved-object-stamp.ts -> canvas/runtime/scene/types.ts": { "count": 1 },
    "canvas/runtime/tools/select/band.ts -> canvas/runtime/scene/design-object-targets.ts": { "count": 1 },
    "canvas/runtime/tools/select/band.ts -> canvas/runtime/scene/locks.ts": { "count": 1 },
    "canvas/runtime/tools/select/click.ts -> canvas/runtime/scene/design-object-targets.ts": { "count": 1 },
    "canvas/runtime/tools/select/click.ts -> canvas/runtime/scene/locks.ts": { "count": 1 },
    "canvas/runtime/tools/select/guide-ends.ts -> canvas/runtime/scene/types.ts": { "count": 1 },
    "canvas/runtime/tools/select/move-drag.ts -> canvas/runtime/scene/design-object-targets.ts": { "count": 1 },
    "canvas/runtime/tools/select/move-drag.ts -> canvas/runtime/scene/types.ts": { "count": 1 },
    "canvas/runtime/tools/select/note-edit.ts -> canvas/runtime/scene/group-members.ts": { "count": 1 },
    "canvas/runtime/tools/select/note-edit.ts -> canvas/runtime/scene/locks.ts": { "count": 1 },
    "canvas/runtime/tools/select/note-edit.ts -> canvas/runtime/scene/types.ts": { "count": 1 },
    "canvas/runtime/tools/select/point-handle.ts -> canvas/runtime/scene/types.ts": { "count": 1 },
    "canvas/runtime/tools/select/reshape.ts -> canvas/runtime/scene/types.ts": { "count": 1 },
    "canvas/runtime/tools/select/rotate-handle.ts -> canvas/runtime/scene/types.ts": { "count": 1 },
    "canvas/runtime/tools/select/select-tool.ts -> canvas/runtime/scene/design-object-targets.ts": { "count": 1 },
    "canvas/runtime/tools/select/select-tool.ts -> canvas/runtime/scene/types.ts": { "count": 1 },
    "canvas/runtime/tools/select/selection-hull.ts -> canvas/runtime/scene/design-object-targets.ts": { "count": 1 },
    "canvas/runtime/tools/select/selection-hull.ts -> canvas/runtime/scene/group-members.ts": { "count": 1 },
    "canvas/runtime/tools/select/selection-hull.ts -> canvas/runtime/scene/types.ts": { "count": 1 },
    "canvas/runtime/tools/spatial-index.ts -> canvas/runtime/scene/types.ts": { "count": 1 },
    "canvas/runtime/tools/stamp-rotation.ts -> canvas/runtime/scene/types.ts": { "count": 1 },
    "canvas/runtime/tools/tool-host.ts -> canvas/runtime/scene/design-object-targets.ts": { "count": 1 },
    "canvas/runtime/tools/tool-host.ts -> canvas/runtime/scene/group-members.ts": { "count": 1 },
    "canvas/runtime/tools/tool-host.ts -> canvas/runtime/scene/types.ts": { "count": 1 },
    "canvas/runtime/tools/tool.ts -> canvas/runtime/scene/design-object-targets.ts": { "count": 1 },
    "canvas/runtime/tools/tool.ts -> canvas/runtime/scene/types.ts": { "count": 1 },
    "canvas/runtime/tools/zone-drag.ts -> canvas/runtime/scene/design-object-targets.ts": { "count": 1 },
    "canvas/runtime/tools/zone-drag.ts -> canvas/runtime/scene/types.ts": { "count": 1 },
    "commands/graph/catalog.ts -> app/shell-commands/shortcut-text.ts": { "count": 1 },
    "commands/graph/projections.ts -> app/shell-commands/menus.ts": { "count": 2 },
    "components/canvas/CanvasContextMenu.tsx -> app/plant-detail/actions.ts": { "count": 1 },
    "components/canvas/InspectionLens.tsx -> app/shell-commands/shortcut-text.ts": { "count": 1 },
    "components/canvas/PlaceSearch.tsx -> app/shell-commands/shortcut-text.ts": { "count": 1 },
    "components/canvas/SelectionChip.tsx -> app/shell-commands/shortcut-text.ts": { "count": 1 },
    "components/canvas/ToolCard.tsx -> app/shell-commands/shortcut-text.ts": { "count": 1 },
    "components/panels/CanvasPanel.tsx -> app/story-presentation/overrides.ts": { "count": 1 },
    "components/panels/FavoritesPanel.tsx -> app/saved-object-stamps/thumbnail-renderer.ts": { "count": 1 },
    "components/shared/GettingStartedDialog.tsx -> app/shell-commands/shortcut-text.ts": { "count": 1 },
    "components/shared/KeyboardShortcutsDialog.tsx -> app/shell-commands/menus.ts": { "count": 2 },
    "components/shared/KeyboardShortcutsDialog.tsx -> app/shell-commands/shortcut-text.ts": { "count": 1 },
    "components/shared/MenuBar.tsx -> app/shell-commands/menus.ts": { "count": 1 },
    "components/shared/PlantFinder.tsx -> app/shell-commands/shortcut-text.ts": { "count": 1 },
    "components/shared/SettingsDialog.tsx -> app/shell-commands/shortcut-text.ts": { "count": 1 },
    "components/shared/StartScreen.tsx -> app/recent-files/locations.ts": { "count": 1 },
    "components/shared/WelcomeScreen.tsx -> app/shell-commands/shortcut-text.ts": { "count": 1 },
    "components/shared/WorkspaceTitleBar.tsx -> app/shell-commands/menus.ts": { "count": 1 },
    "components/stories/RichTextEditor.tsx -> app/shell-commands/shortcut-text.ts": { "count": 1 },
    "platform/desktop.ts -> app/shell-commands/shortcut-text.ts": { "count": 1 },
    "web/WebCanvasWorkspace.tsx -> app/story-presentation/overrides.ts": { "count": 1 },
    "web/WebSpeciesCatalogPanel.tsx -> app/plant-browser/workbench.ts": { "count": 1 },
    "web/WebWelcomeScreen.tsx -> app/shell-commands/shortcut-text.ts": { "count": 1 },
    "web/browser-shell-commands.ts -> app/saved-views/dialogs.ts": { "count": 1 },
    "web/browser-shell-commands.ts -> app/shell-commands/menus.ts": { "count": 1 },
    "web/browser-shell-commands.ts -> app/shell-commands/shortcut-text.ts": { "count": 1 },
    "web/duckdb-wasm-catalog.ts -> app/plant-browser/workbench.ts": { "count": 1 },
    "web/reduced-species-catalog.ts -> app/plant-browser/workbench.ts": { "count": 1 }
  }
}
